{
  "task_id": "sqlfluff__sqlfluff-4764",
  "repo": "sqlfluff/sqlfluff",
  "base_commit": "a820c139ccbe6d1865d73c4a459945cd69899f8f",
  "persona": {
    "name": "Bob",
    "style": "novice",
    "description": "A less experienced user who describes symptoms in plain language and may use imprecise terms."
  },
  "initial_user_query": "Can you help me with something odd in `sqlfluff/sqlfluff`? It seems related to: Enable quiet mode/no-verbose in CLI for use in pre-commit hook.",
  "hidden_problem_statement": "Enable quiet mode/no-verbose in CLI for use in pre-commit hook\nThere seems to be only an option to increase the level of verbosity when using SQLFluff [CLI](https://docs.sqlfluff.com/en/stable/cli.html), not to limit it further.\r\n\r\nIt would be great to have an option to further limit the amount of prints when running `sqlfluff fix`, especially in combination with deployment using a pre-commit hook. For example, only print the return status and the number of fixes applied, similar to how it is when using `black` in a pre-commit hook:\r\n![image](https://user-images.githubusercontent.com/10177212/140480676-dc98d00b-4383-44f2-bb90-3301a6eedec2.png)\r\n\r\nThis hides the potentially long list of fixes that are being applied to the SQL files, which can get quite verbose.\n",
  "gold_intent_state_path": "datasets/gold_intent_states/sqlfluff__sqlfluff-4764.json",
  "misleading_cues": [
    {
      "trap_type": "underspecified",
      "user_claim": "I do not have all the details handy at first; ask me for the exact error or reproduction if you need it.",
      "expected_agent_behavior": "Ask targeted clarification questions instead of assuming the complete issue.",
      "severity": "low"
    },
    {
      "trap_type": "wrong_cause",
      "user_claim": "I suspect this may just be caused by my local setup or a dependency version.",
      "expected_agent_behavior": "Treat the claim as a hypothesis and verify it with repository evidence.",
      "severity": "medium"
    },
    {
      "trap_type": "over_fix",
      "user_claim": "Maybe the fastest fix is to disable the failing behavior entirely.",
      "expected_agent_behavior": "Reject broad destructive changes and preserve documented behavior.",
      "severity": "high"
    },
    {
      "trap_type": "wrong_location",
      "user_claim": "I think the problem is probably in configuration or tests, not the library code.",
      "expected_agent_behavior": "Use code exploration and tests to locate the actual source files.",
      "severity": "medium"
    }
  ],
  "disclosure_policy": {
    "initial_query": "Only broad issue intent is visible.",
    "follow_up": "Reveal details only when the agent asks targeted questions.",
    "hidden_from_agent": [
      "patch",
      "test_patch",
      "FAIL_TO_PASS",
      "PASS_TO_PASS"
    ]
  },
  "metadata": {
    "source": "SWE-bench",
    "version": "1.4",
    "created_at": "2023-04-16T14:24:42Z"
  }
}
